Beleg,Märchen,VK,Editionsverlauf,Kontext,Quelle,Anmerkungen,Dialektgebiet (bei Dialektmärchen)
se sullen dat Schipp man wier vull laen (laden),Ferenand getrü un Ferenand ungetrü,man ndt,,,Haxthausen,Dialektmärchen,ndt
nu gah man up mie sitten un treck mit mie in’t Schipp,Ferenand getrü un Ferenand ungetrü,man ndt,,,Haxthausen,Dialektmärchen,ndt
se sulle man mit den Kinne na der Kerken kummen,Ferenand getrü un Ferenand ungetrü,man ndt,,,Haxthausen,Dialektmärchen,ndt
,De Gaudeif un sien Meester,keine VKVariation,,,Maria Anna (Jenny) von Droste-Hülshoff,Dialektmärchen,ndt
"Do werd et drunken, un do geit et liegen un schlöpd; do geit de Jäger to un bind et an Händen un Föten, do weckt he et wier up un segd",De wilde Mann,et Bezug auf Maskulinum (Belebtheitgeschichte Münsterland et kuh et frau),,,Maria Anna (Jenny) von Droste-Hülshoff,Dialektmärchen,ndt
un he geit wier up sien dreibeenige Perd sitten,De wilde Mann,reflexives gehen,,,Maria Anna (Jenny) von Droste-Hülshoff,Dialektmärchen,ndt
un he genk wier up sin Perd sitten,De wilde Mann,reflexives gehen,,,Maria Anna (Jenny) von Droste-Hülshoff,Dialektmärchen,ndt